{
  "$schema": "http://json-schema.org/draft-07/schema#",
  "$ref": "#/definitions/OrderStatusChangedEvent",
  "definitions": {
    "OrderStatusChangedEvent": {
      "discriminator": "orderEventType",
      "description": "Represents a change in the status of an order.",
      "type": "object",
      "discriminatorValue": "OrderStatusChangedEvent",
      "additionalProperties": true,
      "required": [
        "orderEventType",
        "newOrderStatus",
        "orderId",
        "id",
        "oldOrderStatus"
      ],
      "properties": {
        "id": {
          "anyOf": [
            {
              "type": "string"
            },
            {
              "type": "null"
            }
          ],
          "description": "Unique identifier for the entity, can be null on create if auto-generated"
        },
        "orderEventType": {
          "type": "string",
          "description": "Discriminator identifying the specific type of event instance (for example, OrderStatusEvent)"
        },
        "auditInfo": {
          "type": "object",
          "description": "Defines standard system audit fields available for most types",
          "additionalProperties": true,
          "required": [
            "isDeleted",
            "createdBy",
            "updatedBy",
            "updatedDate",
            "createdDate"
          ],
          "properties": {
            "createdDate": {
              "anyOf": [
                {
                  "type": "string",
                  "format": "date-time"
                },
                {
                  "type": "null"
                }
              ],
              "description": "Timestamp of when the entity was created"
            },
            "createdBy": {
              "type": "string",
              "description": "Identifies the system or user which created the entity"
            },
            "updatedDate": {
              "anyOf": [
                {
                  "type": "string",
                  "format": "date-time"
                },
                {
                  "type": "null"
                }
              ],
              "description": "Timestamp of when the entity was last updated"
            },
            "updatedBy": {
              "type": "string",
              "description": "Identifies the system or user which last updated the entity"
            },
            "isDeleted": {
              "anyOf": [
                {
                  "type": "boolean"
                },
                {
                  "type": "null"
                }
              ],
              "description": "Indicates whether or not the entity has been soft-deleted"
            }
          }
        },
        "orderId": {
          "type": "string",
          "description": "Identifies the order that produced this event"
        },
        "oldOrderStatus": {
          "type": "string",
          "description": "Previous order status value"
        },
        "newOrderStatus": {
          "type": "string",
          "description": "Current order status value"
        }
      }
    }
  }
}